{
    "@context": "https://standards-ontotest.oftrust.net/v2/Context/Identity/Equipment/Device/Cabel/",
    "@type": "Cabel",
    "@id": "",
    "data": {
        "fireClassification": "",
        "height": "",
        "fireSmokeDevelopment": "",
        "power": "",
        "electricityVoltageNominal": "",
        "installationType": "",
        "colorCode": "",
        "areaNet": "",
        "url": "",
        "fireFlamingParticlesDevelopment": "",
        "acidityLevel": "",
        "status": "",
        "categorizationLocal": "",
        "idLocal": "",
        "amountCores": "",
        "fireReaction": "",
        "ifcElementName": "",
        "weight": "",
        "amountFibres": "",
        "industryDomain": "",
        "installationTypeAvailable": "",
        "volume": "",
        "typeNameConductor": "",
        "width": "",
        "serialNumber": "",
        "protectionCommon": "",
        "categorizationETIM": "",
        "length": "",
        "typeName": "",
        "diameterOuter": "",
        "name": "",
        "ifcElementType": "",
        "descriptionGeneral": "",
        "colorName": "",
        "protectionTypeStrandingElement": "",
        "areaGross": "",
        "ifcGuid": "",
        "electricityCurrent": "",
        "thickness": "",
        "fireResistanceInsulation": ""
    },
    "metadata": {
        "updatedAt": "",
        "createdBy": "",
        "updatedBy": "",
        "createdAt": ""
    },
    "function": ""
}